r-67	0	*	The socks are ready for you to try and the garters on.
r-67	0	*	John is ready for you to inspect bunk.
r-67	0	*	The socks are ready for for you to put on to be planned.
r-67	0	*	The socks are ready for it to be planned for you to put on.
r-67	1		It is difficult to play sonatas on this violin.
r-67	1		It is tough to play sonatas on this violin.
r-67	1		Sonatas are difficult to play on this violin.
r-67	1		Sonatas are tough to play on this violin.
r-67	1		This violin is easy to play sonatas on.
r-67	1		I made it easy to get along with John.
r-67	1		John tries to be easy to get along with.
r-67	0	*	John tried Bill to play checkers.
r-67	0	*	John tried for Bill to play checkers.
r-67	0	*	My mother is easy to please my father and.
r-67	0	*	Bill would be easy for for you to chat with in Moscow to become expensive.
r-67	0	*	.Bill would be easy for it to become expensive for you to chat with in Moscow.
r-67	1		My father, he's Armenian, and my mother, she's Greek.
r-67	0	*	If my father, he comes home late, my mother always grills him.
r-67	0	*	It started to rain after Jackie and me, we had finally gotten to our seats.
r-67	.1	?*	I acknowledged that my father, he was tight as a hoot-owl.
r-67	1		I said that my father, he was tight as a hoot-owl.
r-67	.5	?	If my father, he comes late, my mother, she always grills him.
r-67	0	*	I'm going to write to the Game Warden if more than one deer my neighbor brings back.
r-67	0	*	I don't know the boy who the flowers Mary gave to.
r-67	0	*	I don't know the boy the flowers who Mary gave to.
r-67	.5	?	The CIA claims that informers they never use.
r-67	0	*	That informers they never use is claimed by the CIA.
r-67	1		This guitar, I've sung folksongs and accompanied myself on it all my life.
r-67	1		My father, that he's lived here all his life is well-known to the cops.
r-67	1		They spoke to the janitor about that robbery yesterday, the cops.
r-67	1		The cops spoke to him about that robbery yesterday, the janitor.
r-67	1		That they spoke to the janitor about that robbery yesterday, the cops, is terrible.
r-67	1		That the cops spoke to the janitor about it yesterday, that robbery, is terrible.
r-67	.1	?*	That the cops spoke to the janitor about it yesterday is terrible, that robbery.
r-67	0	*	They let him go yesterday, he.
r-67	0	*	They let him go yesterday, him.
r-67	0	*	They can't stand each other, they.
r-67	0	*	They can't stand each other, them.
r-67	1		We'll do it together, you and I.
r-67	1		They can't stand each other, he and she.
r-67	1		They can't stand each other, him and her.
r-67	0	*	He, they let him go yesterday.
r-67	1		Him, they let him go yesterday.
r-67	0	*	I, I like beer.
r-67	1		Me, I like beer.
r-67	0	*	They, they can't stand each other.
r-67	1		I saw Mary and him downtown yesterday, your friend from Boston.
r-67	1		I noticed his car in the driveway last night, your friend from Boston.
r-67	0	*	I spoke to about the war yesterday that guy who's always following us.
r-67	1		I spoke to him about the war yesterday, that guy who's always following us.
r-67	1		I just_ saw that girl who Long John's claim hat whe was a Venusian made all the headlines.
r-67	1		Didn't that guy who the Game Warden and him had seen a flying saucer crack up?
r-67	1		King Kong is a movie which you'll laugh yourself sick if you see it.
r-67	1		Enrico, who is the smartest of us all, got the answer in seven seconds.
r-67	1		Enrico, and he is the smartest of us all, got the answer in seven seconds.
r-67	0	*	Any student, who wears socks, is a swinger.
r-67	0	*	Any student, and he wears socks, is a swinger.
r-67	0	*	No student, and he wears socks, is a swinger.
r-67	0	*	Every student, and he wears socks, is a swinger.
r-67	1		There are seven pine trees behind that barn.
r-67	1		That barn has seven pine trees behind it.
r-67	1		There will be a hole in Jack's pocket.
r-67	0	*	There will be the hole in Jack's pocket.
r-67	1		Jack will have a hole in his pocket.
r-67	0	*	That barn has seven pine trees behind itself.
r-67	1		Jack's pocket will have a hole in it.
r-67	.3	??	There is a hole in John's quilt's upper right-hand corner.
r-67	.3	??	John's quilt's upper right-hand corner has a hole.
r-67	1		John's quilt has a hole in its upper right-hand corner.
r-67	.3	??	John has a hole in his quilt's upper right-hand corner.
r-67	1		John has a hole in the upper right-hand corner of his quilt.
r-67	1		There are seven holes in the door and window.
r-67	0	*	The door has seven holes in it and the window.
r-67	0	*	The window has seven holes in the door and it.
r-67	1		There is a blemish on the end of Jerry's sister's nose.
r-67	0	*	Jerry has a blemish on the end of his sister's nose.
r-67	1		Jerry's sister has a blemish on the end of her nose.
r-67	1		There is a hole in the rug which Toby bought in Boston.
r-67	1		There was an error in the proof Johns presented.
r-67	1		There was a snake behind the car Fred was sitting in.
r-67	.5	?	Toby has a hole in the rug which he bought in Boston.
r-67	.5	?	Toby has a hole in the rug which Mike bought in Boston.
r-67	1		John had an error in the proof he presented.
r-67	1		Fred had a snake behind the car Joe was sitting in.
r-67	1		There was a yellow collar on the dog which the car injured.
r-67	1		There's a hole in the tarpaulin which that stone is holding down.
r-67	1		There was a snake behind the car the time bomb was sitting in.
r-67	0	*	The car had a yellow collar on the dog which it injured.
r-67	0	*	The time bomb had a snake behind the car which it was sitting in.
r-67	1		The hot potato which there were several hundred people yelling for me to put down gently turned out to have been filled with TNT.
r-67	0	*	The hot potato had several hundred people yelling for me to put it down gently.
r-67	1		Bartlett danced with Toni.
r-67	0	*	The only girl for whom it bothers me to wear that old fedora is Annabelle.
r-67	0	*	The only girl who it bothers me to wear that old fedora is Annabelle.
r-67	1		I would prefer it for there to be no talking.
r-67	1		I would prefer there to be no talking.
r-67	1		He gave my binoculars to that girl.
r-67	1		He gave that girl my binoculars.
r-67	1		Which girl did he give my binoculars to?
r-67	0	*	Which girl did he give my binoculars?
r-67	1		Bill confirmed that Roger has eaten the cake.
r-67	1		Bill alleged that Roger had eaten the cake.
r-67	.3	??	What did Bill confirm that Roger had eaten?
r-67	1		Bill didn't allege that Roger had eaten anything.
r-67	0	*	Waldo didn't report the possibility that anyone had left.
r-67	1		Waldo didn't report that anyone had left.
r-67	1		Nobody who hates to eat anything should work in a delicatessen.
r-67	1		Anybody who ever swears at me better watch his step.
r-67	1		Everybody around here who ever buys anything on credit talks in his sleep.
r-67	1		I want all the students who have ever tried to pat Fido to show me their scars.
r-67	1		The only travelers who anybody has ever robbed don't carry machetes.
r-67	0	*	I can't remember the name of somebody who had misgivings.
r-67	1		I can't remember the name of anybody who had any misgivings.
r-67	1		Everybody who has ever, worked in any office which contained any typewriter which had ever been used to type any letters which had to be signed by any administrator who ever worked in any department like mine will know what I mean.
r-67	1		No student who ever goes to Europe ever has enough money.
r-67	0	*	Every student who ever goes to Europe ever has enough money.
r-67	.5	?	I didn't eat the ice cream and some cake.
r-67	0	*	I didn't eat the ice cream and any cake.
r-67	1		I realized that it had rained and some crops had been destroyed.
r-67	1		I didn't realize that it had rained and some crops had been destroyed.
r-67	0	*	I didn't realize that it had rained and any crops had been destroyed.
r-67	1		I didn't eat any ice cream or any cake.
r-67	0	*	I didn't eat any ice cream and any cake.
r-67	0	*	I didn't eat any ice cream or Mary's cake.
r-67	0	*	I didn't eat any ice cream or the cake.
r-67	.5	?	I didn't eat Mary's cake or any ice cream.
r-67	1		John met Mary in Vienna.
r-67	0	*	Few writers and any playwrights meet in Vienna.
r-67	0	*	My brother and few Americans meet in Vienna.
r-67	1		My brother meets few Americans in Vienna.
r-67	1		No writer, and no playwright, speaks clearly.
r-67	1		No writer, nor any playwright, speaks clearly.
r-67	0	*	No writer, and no playwright, meets in Vienna.
r-67	0	*	Bill understands Mary and himself.
r-67	.1	?*	Bill understands himself and Mary.
r-67	0	*	Bill and Mary washed himself.
r-67	0	*	The gun and a description of itself lay on the bureau.
r-67	1		Bill believes Anna and him to be similar.
r-67	0	*	I deny that that Bob has any money is certain.
r-67	1		I deny that it is certain that Bob has any money.
r-67	.3	??	I deny that that Bob has some money is certain.
r-67	1		Tom will force you to marry no student.
r-67	0	*	The writers of any of the reports didn't know the answer.
r-67	1		The writers of none of the reports.
r-67	1		Tom will force you to marry no student, and neither will I.
r-67	1		The writers of none of the reports knew the answer, and neither did the writers of any of the chronicles.
r-67	1		It is not certain that you'll marry any student.
r-67	1		That you will marry any particular student is not certain.
r-67	1		That you will marry any student is not certain.
r-67	1		The man who I gave John a picture of was bald.
r-67	.3	??	The man who I gave John this picture of was bald.
r-67	0	*	The man who I gave John Ed's picture of was bald.
r-67	0	*	I gave Jack Ed's picture of myself.
r-67	1		I didn't give Jack a picture of anybody.
r-67	0	*	I didn't give Jack this picture of anybody.
r-67	1		I hope I'm not treading on anyone's toes.
r-67	0	*	That the sun is out was obvious.
r-67	1		That the sun was out is obvious.
r-67	1		That anybody ever left at all is not certain.
r-67	1		That anybody ever left at all is impossible.
r-67	1		Tonight, what Bob cooked yesterday still tastes good.
r-67	1		Tonight, what Bob cooked yesterday still tastes good, so tonight, what Bob cooked yesterday will be eaten up.
r-67	1		Tonight, what Bob cooked yesterday still tastes good, so tonight it will be eaten up.to Myrna.
rhl07	1		Martha gave Myrna an apple.
rhl07	1		Leigh threw the ball to Lane.
rhl07	1		Leigh threw Lane the ball.
rhl07	1		Jill threw the ball from home plate to third base.
rhl07	1		Jill kicked the ball from home plate to third base.
rhl07	1		Fred threw the ball behind the tree.
rhl07	1		Fred kicked the ball under the porch.
rhl07	1		Felicia kicked the ball out the window.
rhl07	1		Felicia kicked the ball off the bench.
rhl07	0	*	Felicia sent the box out of the storeroom.
rhl07	0	*	Felicia shipped the box off the shelf.
rhl07	0	*	Felicia shipped the box out of the storeroom.
rhl07	0	*	Jake sent the box towards Carson.
rhl07	1		Anne is curious as to why her father sent her a telegram to America to return home at once.
rhl07	1		Where did you throw the ball? To third base.
rhl07	1		I gave the package to Maria.
rhl07	0	*	I gave the package to London.
rhl07	1		I sent the package to Maria.
rhl07	1		I sent the package to London.
rhl07	1		I threw the ball to Maria.
rhl07	0	*	Susan gave the ball halfway to Bill.
rhl07	0	*	Susan gave the ball all the way to Bill.
rhl07	1		Jake threw the ball all the way to Bill.
rhl07	1		I sent the package halfway around the world.
rhl07	1		I sent the package to the Antarctic.
rhl07	1		I shipped the package halfway around the world.
rhl07	0	*	Fred gave the ball under Molly.
rhl07	0	*	Fred offered the ball under Molly.
rhl07	0	*	Fred offered the ball behind Molly.
rhl07	0	*	Fred offered the ball over Molly.
rhl07	0	*	Sam gave the ball off the shelf.
rhl07	0	*	Sam gave the ball out of the basket.
rhl07	0	*	Sam offered the ball off the shelf.
rhl07	0	*	Sam offered the ball out of the basket.
rhl07	0	*	Jill gave the ball at Bob.
rhl07	0	*	Jill gave the ball towards Bob.
rhl07	0	*	Jill offered the ball at Bob.
rhl07	0	*	Jill offered the ball towards Bob.
rhl07	1		Give a fresh coat of paint to the front door.
rhl07	1		One of the Jewish children is a spunky girl, who gave a black eye to the kid with the German roots before the start of the war.
rhl07	1		Cultural commissioner Megan Whilden said that the five ‘Artscape’ pieces would ‘give a festive air to Park Square, they’re fun and interesting.
rhl07	1		The spunky girl has a black eye.
rhl07	1		Park Square has a festive air.
rhl07	1		I promise a good time to all who come.
rhl07	1		The worker will have a job.
rhl07	1		He died from exhaustion.
rhl07	1		The water melted into ice.
rhl07	1		The water melted to ice.
rhl07	1		A hefty sum of money came to him from his grandfather.
rhl07	1		She fell in love.
rhl07	1		She fell into a funk.
rhl07	0	*	Where did you give the ball?
rhl07	1		To whom did you throw the ball?
rhl07	1		Where did you throw the ball?
rhl07	1		To whom did you send the package?
rhl07	1		Where did you send the package?
rhl07	1		Smith threw the first baseman the ball.
rhl07	0	*	Smith threw the first base the ball.
rhl07	0	*	Smith envied his good fortune to Jones.
rhl07	0	*	No one can forgive that comment to you.
rhl07	1		The recession cost my grandfather a raise.
rhl07	1		Mary taught John linguistics.
rhl07	1		Mary taught linguistics to John.
rhl07	1		We launched the rocket to the moon, but it blew up before it got there.
rhl07	1		I threw the ball to Julian, but it fell short of him.
rhl07	1		Lewis sent a bicycle to Sam, but it never arrived.
rhl07	1		Lewis shipped a bicycle to Sam, but it never arrived.
rhl07	.8	#	I pulled the box to the door, but stopped before I got there.
rhl07	.8	#	I dragged the box to the door, but stopped before I got there.
rhl07	1		Max offered the victims help, but they refused his offer.
rhl07	1		Max offered help to the victims, but they refused his offer.
rhl07	1		I taught them English for an entire year, but they don’t seem to have learned.
rhl07	1		I read him the figures, but when I looked up, he was gone.
rhl07	1		I throw you a lifeline and you giggle.
rhl07	1		I kicked him the ball, but the wind blew it astray.
rhl07	1		I threw the ball to Mary, but she was looking at the birds flying overhead and didn't even notice.
rhl07	1		Lewis shipped Sam a bicycle, but it never arrived.
rhl07	1		Lewis sent Sam a bicycle, but it never arrived.
rhl07	1		Lewis sent a bicycle to Sam, but it never arrived.
rhl07	1		Lewis shipped a bicycle to Sam, but it never arrived.
rhl07	1		The police read the detainees’ rights to them, but not a single one was paying attention.
rhl07	1		I wrote a letter to Blair, but I tore it up before I sent it.
rhl07	1		The police read the detainees their rights, but not a single one was paying attention.
rhl07	1		I wrote Blair a letter, but I tore it up before I sent it.
rhl07	1		Ann copied the manuscript, but she didn’t finish it.
rhl07	1		Alex read the newspaper for an hour.
rhl07	0	*	I lent the book partway to Tony.
rhl07	0	*	I lent the book all the way to Tony.
rhl07	0	*	I lent the book most of the way to Tony.
rhl07	0	*	I lent Tony the book partway.
rhl07	0	*	I lent Tony the book halfway.
rhl07	0	*	I lent Tony the book all the way.
rhl07	0	*	I lent Tony the book most of the way.
rhl07	0	*	Robin arrived partway at the station.
rhl07	0	*	Robin arrived halfway at the station.
rhl07	0	*	Robin arrived most of the way at the station.
rhl07	0	*	The old dog died partway.
rhl07	0	*	The old dog died halfway.
rhl07	0	*	The old dog died all the way.
rhl07	1		Sandy taught the children the alphabet, but only got as far as the letter ‘r’.
rhl07	1		Maxine read the children Goodnight Moon, but they fell asleep before she got to the end.
rhl07	1		Interviewing Richard Nixon gave Norman Mailer a book.
rhl07	1		Nixon’s behavior gave Mailer an idea for a book.
rhl07	.8	#	Nixon’s behavior gave an idea for a book to Mailer.
rhl07	1		Nixon’s behavior gave an idea for a book to every journalist living in New York City in the 1970s.
rhl07	1		We gave a fresh coat of paint to the house.
rhl07	1		You could give a headache to a Tylenol.
rhl07	1		Gordie Gillespie still can give a piece of his mind to the umps.
rhl07	1		I sent the salesman to the devil.
rhl07	0	*	I sent the devil the salesman.
rhl07	.8	#	Nixon’s behavior gave an idea for a book to Mailer.
rhl07	1		Nixon’s behavior gave an idea for a book to every journalist living in New York.
rhl07	1		We gave a fresh coat of paint to the house.
rhl07	1		The music lent a festive air to the party.
rhl07	1		It is very difficult to get an idea for a book simply from an interview.
rhl07	1		It is unreadable, guaranteed to give a headache to anyone who looks hard at the small print.
rhl07	1		‘Doing my taxes’ gives a headache to 22 percent of Americans surveyed for Bristol-Myers Squibb, which makes Excedrin pain-relief medicine.
rhl07	1		Nevarez says that he has done more than simply give a fresh coat of paint to the site.
rhl07	1		I think it’s time you give your lovely illness to someone else!
l-93	1		The farmer loaded apples into the cart.
l-93	1		The farmer loaded the cart with apples.
l-93	1		Monica covered the baby with a blanket.
l-93	1		Gina filled the pitcher with lemonade.
l-93	1		Carla poured lemonade into the pitcher.
l-93	0	*	The farmer dumped the cart with apples.
l-93	1		The window broke.
l-93	1		The little boy broke the window.
l-93	0	*	The magician appeared a rabbit out of his hat.
l-93	1		Martha carved a toy out of wood for the baby.
l-93	1		Martha carved the baby a toy out of wood.
l-93	1		Martha carved some wood into a toy for the baby.
l-93	0	*	Martha carved the baby some wood into a toy.
l-93	1		Margaret cut the bread.
l-93	1		Janet broke the vase.
l-93	1		Carla hit the door.
l-93	1		The bread cuts easily.
l-93	0	*	Cats touch easily.
l-93	0	*	Door frames hit easily.
l-93	1		Margaret cut at the bread.
l-93	0	*	Janet broke at the vase.
l-93	0	*	Terry touched at the cat.
l-93	1		Margaret cut Bill's arm.
l-93	1		Janet broke Bill's finger.
l-93	0	*	Janet broke Bill on the finger.
l-93	1		Terry touched Bill's shoulder.
l-93	1		Terry touched Bill on the shoulder.
l-93	1		Carla hit Bill on the back.
l-93	1		Jean moved the table.
l-93	1		The window broke.
l-93	1		The little boy broke the window.
l-93	1		Margaret cut the string.
l-93	0	*	The string cut.
l-93	0	*	The cat touched.
l-93	1		Carla hit the door.
l-93	1		a The butcher cuts the meat.
l-93	1		Crystal breaks at the slightest touch.
l-93	1		Joan knew the answer.
l-93	0	*	The answer knows easily.
l-93	0	*	This metal won't pound.
l-93	1		This metal won't pound flat.
l-93	1		Janet broke the cup.
l-93	1		The cup broke.
l-93	1		They gave the bicycle to me.
l-93	0	*	The bread cut.
l-93	1		A dove appeared from the magician's sleeve.
l-93	1		The horse jumped over the fence.
l-93	1		The rats ran through the maze.
l-93	1		The visitor rang the bell.
l-93	1		The bell rang.
l-93	1		The statue stood on the pedestal.
l-93	1		I burped the baby.
l-93	1		The baby burped.
l-93	1		Heat radiates from the sun.
l-93	1		The sun radiates heat.
l-93	1		Mike ate the cake.
l-93	1		Mike ate.
l-93	1		I flossed my teeth.
l-93	1		I flossed.
l-93	1		Celia braided her hair.
l-93	0	*	Celia braided.
l-93	0	*	Tessa sprained.
l-93	1		I flossed.
l-93	0	*	I flossed myself.
l-93	0	*	Celia brushed.
l-93	1		Tessa cut herself.
l-93	0	*	Tessa cut.
l-93	1		We loaded ourselves onto the bus.
l-93	1		We loaded onto the bus.
l-93	1		We pulled free.
l-93	1		Anne and Cathy met.
l-93	0	*	Brenda bantered Molly.
l-93	0	*	The drunk and the lamppost hugged.
l-93	1		Italy touches France.
l-93	1		Italy and France touch.
l-93	0	*	Ellen chitchatted Helen.
l-93	1		The sign warned us against skating on the pond.
l-93	1		The sign warned against skating on the pond.
l-93	1		That movie always shocks people.
l-93	1		That movie always shocks.
l-93	1		for discussion of the same phenomenon in Russian.
l-93	1		That dog bites people.
l-93	1		I cut the bread with this knife.
l-93	1		This knife cut the bread.
l-93	1		This knife doesn't cut.
l-93	1		This oven cooks well.
l-93	1		This lotion softens, soothes, moisturizes, and protects.
l-93	1		This polish cleans, protects, and shines.
l-93	1		This key won't open the Jock.
l-93	0	*	This hammer won't break.
l-93	1		This hammer won't break the window.
l-93	1		They pushed their way through the crowd.
l-93	1		Bake for 30 minutes.
l-93	0	*	Like the ice cream.
l-93	0	*	Like after tasting.
l-93	1		Paula hit at the fence.
l-93	1		Margaret cut the bread.
l-93	1		Margaret cut at the bread.
l-93	1		Faustina sprayed the lilies.
l-93	1		Faustina. sprayed at the lilies.
l-93	0	*	Janet broke at the bread.
l-93	1		I pushed at the table.
l-93	1		I pushed on the table.
l-93	1		I pushed against the table.
l-93	1		The mouse nibbled the cheese.
l-93	1		The mouse nibbled on the cheese.
l-93	1		Martha climbed up the mountain.
l-93	1		They skated along the canals.
l-93	1		They skated the canals.
l-93	1		The spaceship revolves around the earth.
l-93	1		Martha slowly descended the stairs.
l-93	0	*	Sharon came the room.
l-93	1		Jill met Sarah.
l-93	1		Jill embraced Sarah.
l-93	1		Bill sent a package to Tom.
l-93	1		Bill sent a package London.
l-93	1		Bill sent Tom a package.
l-93	1		Martha carved the baby a toy.
l-93	1		The architect selected a house for the couple.
l-93	0	*	The architect selected the couple a house.
l-93	1		Jack sprayed paint on the wall.
l-93	1		Jack sprayed the wall with paint.
l-93	0	*	June covered the blanket over the baby.
l-93	1		June covered the baby with a blanket.
l-93	0	*	Tamara poured the bowl with water.
l-93	1		Henry cleared dishes from the table.
l-93	1		Henry cleared the table of dishes.
l-93	0	*	The thief stole the museum of the painting.
l-93	0	*	Helen wiped the wall of fingerprints.
l-93	1		Bees are swarming in the garden.
l-93	0	*	People are seething in the square.
l-93	0	*	The pasture is herding with cattle.
l-93	1		Clouds cleared from the sky.
l-93	1		The sky cleared.
l-93	1		Martha carved the piece of wood into a toy.
l-93	0	*	David constructed the bricks into a house.
l-93	1		I kneaded the dough into a loaf.
l-93	1		The witch turned him into a frog.
l-93	0	*	The witch turned him from a prince.
l-93	1		That acorn will grow into an oak tree.
l-93	1		An oak tree will grow from that acorn.
l-93	1		He turned into a frog.
l-93	1		The witch turned him from a prince into a frog.
l-93	1		Martha carved the piece of wood into a toy.
l-93	0	*	Martha carved the piece of wood from a branch into a toy.
l-93	0	*	I kneaded the dough from a lump into a loaf.
l-93	1		He turned into a frog.
l-93	1		He turned from a prince into a frog.
l-93	1		That acorn will grow into an oak tree.
l-93	1		The car collided with the fence.
l-93	1		I separated the yolk from the white.
l-93	1		I mixed the sugar into the butter.
l-93	1		I mixed the sugar and the butter.
l-93	1		I confused Maria with Anna.
l-93	1		I confused Maria and Anna.
l-93	1		Linda taped the label to the cover.
l-93	0	*	Harriet alternated folk songs and pop songs together.
l-93	0	*	I unscrewed the handle and the box apart.
l-93	1		Brenda and Molly agreed.
l-93	1		The oil and vinegar separated.
l-93	0	*	Bill married with Kathy.
l-93	1		The twig broke off of the branch.
l-93	1		The twig broke off the branch.
l-93	1		The eggs and the cream mixed together.
l-93	1		The twig and the branch broke apart.
l-93	0	*	The yolk and the white separated apart.
l-93	1		The judge presented the winner with a prize.
l-93	0	*	The judge saddled a prize to the winner.
l-93	1		The judge saddled the winner with a prize.
l-93	0	*	The jeweller copied the ring with the name.
l-93	0	*	The jeweller decorated the name on the ring.
l-93	1		The jeweller decorated the ring with the name.
l-93	1		Don swatted the mosquito with the newspaper.
l-93	0	*	Brian threw the fence with the stick.
l-93	1		Paula hit the fence with the stick.
l-93	1		Mira blamed the accident on Terry.
l-93	1		Mira blamed Terry for the accident.
l-93	1		Ida hunted the woods for deer.
l-93	1		Ida hunted for deer in the woods.
l-93	1		Melissa searched the papers for a clue.
l-93	1		Melissa searched for a clue in the papers.
l-93	0	*	Melissa searched a clue in the papers.
l-93	1		I stalked the woods for game.
l-93	0	*	I stalked for game in the woods.
l-93	1		We investigated the area for bombs.
l-93	0	*	We investigated for bombs in the area.
l-93	0	*	We investigated bombs in the area.
l-93	1		We rummaged through the desk for papers.
l-93	0	*	I ferreted the woods for game.
l-93	0	*	I ferreted for game in the woods.
l-93	1		Selina touched the horse on the back.
l-93	1		The horse kicked Penny in the shin.
l-93	1		The horse kicked Penny's shin.
l-93	1		Alison poked Daisy in the ribs.
l-93	1		Alison poked Daisy's ribs.
l-93	0	*	The horse broke Penny in the shin.
l-93	1		The horse broke Penny's shin.
l-93	0	*	The glass cut Rachel in the toe.
l-93	1		The glass cut Rachel's toe.
l-93	1		They praised the volunteers for their dedication.
l-93	1		I admired him for his courage.
l-93	1		The inspector analyzed the building's soundness.
l-93	1		The inspector analyzed the building for its soundness.
l-93	0	*	I sensed him for his eagerness.
l-93	1		I admired his honesty.
l-93	1		I admired the honesty in him.
l-93	1		They praised the volunteers' dedication.
l-93	0	*	They praised the dedication in the volunteers.
l-93	1		I admired him for his honesty.
l-93	1		I admired the honesty in him.
l-93	0	*	I sensed him for his eagerness.
l-93	1		I sensed the eagerness in him.
l-93	1		They praised the volunteers for their dedication.
l-93	0	*	They praise the dedication in the volunteers.
l-93	1		Mark terrified me with his singlemindedness.
l-93	1		Mark's singlemindedness terrified me.
l-93	1		The clown amused the children with his antics.
l-93	1		The clown's antics amused the children.
l-93	1		Meat fell in price.
l-93	1		The price of meat fell.
l-93	1		The president appointed Smith press secretary.
l-93	1		Angela characterized Shelly as a lifesaver.
l-93	0	*	The captain named the ship as Seafarer.
l-93	1		The world saw the beginning of a new era in 1492.
