ks08	0	*	She thought it was easy for everyone would fit into the car.
ks08	0	*	She thought it was easy for everyone would fit into the car.
ks08	1		The umpire called off the game.
ks08	1		The umpire called the game off.
ks08	1		The two boys looked the word up.
ks08	1		The umpire fell off the deck.
ks08	1		The two boys looked up the high stairs from the floor.
ks08	1		The umpire called it of.
ks08	0	*	The umpire called off it.
ks08	0	*	The umpire fell it off.
ks08	1		A man kicked the ball.
ks08	1		The happy student played the piano.
ks08	1		The piano kicked a student.
ks08	1		The tall man kicked the ball.
ks08	1		The tall, handsome man kicked the ball.
ks08	1		The happy, happy, happy, happy, happy, happy man sang a song.
ks08	1		The mother of the boy and the girl is arriving soon.
ks08	1		The mother of the boy and the girl is arriving soon.
ks08	1		The mother of the boy and the girl are arriving soon.
ks08	1		John saw the man with a telescope.
ks08	1		I like chocolate cakes and pies.
ks08	1		We need more intelligent leaders.
ks08	1		John saw the man with a telescope.
ks08	1		The student enjoyed his English syntax class last semester.
ks08	1		The policeman met several young students in the park last night.
ks08	1		It was several young students that the policeman met in the park last night.
ks08	0	*	It was the policeman met that several young students in the park last night.
ks08	0	*	It was several young students in that the policeman met the park last night.
ks08	0	*	It was in the park last night that the policeman met several young students.
ks08	1		Where did the policeman meet several young students?
ks08	1		did the policeman meet in the park?
ks08	1		What did you put in your box?
ks08	1		Where did you put the book?
ks08	1		What did he look up?
ks08	1		Up what did he look?
ks08	1		What do you think the man who is standing by the door is doing now?
ks08	1		Have you been to Seoul?
ks08	1		John might pass the exam, and as might Bill.
ks08	0	*	John asked me to put the clothes in the cupboard, but I did so =put the clothes in the suitcase.
ks08	1		The children were neither in their rooms nor on the porch.
ks08	1		She was poor but quite happy.
ks08	1		Many people drink beer or wine.
ks08	0	*	Lee went to the store and crazy.
ks08	1		liked ice cream.
ks08	0	*	the whistle tune was beautiful.
ks08	0	*	the easily student finished his homework.
ks08	0	*	the my dog is a terrier.
ks08	1		The monkey wants to leave the meeting.
ks08	1		The monkeys approved of their leader.
ks08	0	*	The monkeys proud of their leader.
ks08	1		The men practice medicine.
ks08	0	*	The men doctors of medicine.
ks08	1		The teacher met his students in the class.
ks08	0	*	John sounded happily.
ks08	0	*	John sounded the student.
ks08	1		The monkeys seem eager to leave the meeting.
ks08	0	*	John seems know about the bananas.
ks08	1		John seems certain about the bananas.
ks08	1		John came from Seoul.
ks08	1		They put the book in the box.
ks08	1		The fly fell into the soup.
ks08	1		The squirrel ran right up the tree.
ks08	0	*	The squirrel ran straight quickly.
ks08	0	*	The squirrel ran right quickly.
ks08	1		This handsome man chased a dog.
ks08	1		Bill claims John believes Mary thinks Tom is honest.
ks08	1		Jane imagines Bill claims John believes Mary thinks Tom is honest.
ks08	1		The little boy hit the child with a toy.
ks08	1		Chocolate cakes and pies are my favorite desserts.
ks08	0	*	The children were in their rooms or happily.
ks08	0	*	Lee went to the store and crazy.
ks08	1		John suddenly put off the customers.
ks08	0	*	John suddenly got the bus off.
ks08	1		His second book came out earlier this year and became an instant best-seller.
ks08	1		When you book something such as a hotel room, you arrange to have it.
ks08	1		No doubt that he was forced to leave his family against his will.
ks08	1		He intended to will the large amount of money to Frank.
ks08	1		Jane stood aside to let her pass.
ks08	1		He has a rail pass that’s right for you.
ks08	1		I think that person we met last week is insane.
ks08	1		We believe that he is quite reasonable.
ks08	1		I forgot to return the book that I borrowed from the teacher.
ks08	1		I am anxious that you should arrive on time.
ks08	0	*	I am anxious that you to arrive on time.
ks08	1		I am anxious for you to arrive on time.
ks08	0	*	I am anxious for you should arrive on time.
ks08	1		I wonder whether you’d be kind enough to give us information.
ks08	1		If students study hard, teachers will be happy.
ks08	1		John bought a book on the table.
ks08	1		John put a book on the table.
ks08	1		She turned down the side street.
ks08	1		He looked at a book about swimming.
ks08	1		He talked to a girl about swimming.
ks08	1		He talked with a girl about swimming.
ks08	1		John called the president a fool.
ks08	0	*	A nuclear explosion would wipe out plant life and out animal life.
ks08	0	*	He ran down the road and down the President.
ks08	0	*	I know the truth and that you are innocent.
ks08	0	*	Lee went to the store and crazy.
ks08	1		John refused the offer proudly.
ks08	1		I saw him leaving the main building.
ks08	1		He took John to the school by the park.
ks08	1		John sang a song and danced to the music.
ks08	1		John wants to study linguistics in near future.
ks08	1		They told Angelica to arrive early for the award.
ks08	1		That Louise had abandoned the project surprised everyone.
ks08	1		I know you like the back of my hand.
ks08	1		I need to have that report on our web page by tomorrow.
ks08	1		The monkey was tagged in the forest by John.
ks08	1		The cat devoured the rat.
ks08	1		The rat devoured the cat.
ks08	1		It rains.
ks08	0	*	These books sadden me.
ks08	1		Our neighbor takes his children to school in his car.
ks08	0	*	Our neighbor take his children to school in his car.
ks08	0	*	The book, including all the chapters in the first section, are very interesting.
ks08	0	*	The effectiveness of teaching and learning *depend on several factors.
ks08	1		The tornadoes that tear through this county every spring are more than just a nuisance.
ks08	0	*	The tornadoes that tear through this county every spring is more than just a nuisance.
ks08	1		The lady singing with a boy is a genius, isn’t he?
ks08	0	*	With their teacher, the kids have arrived safely, hasn’t he?
ks08	1		This teacher is a genius.
ks08	1		The kids have arrived safely.
ks08	1		It could be more detrimental.
ks08	1		Could it be more detrimental?
ks08	1		The kids in our class have arrived safely.
ks08	0	*	Have in our class the kids arrived safely?
ks08	1		His girlfriend bought this computer.
ks08	1		That silly fool broke the teapot.
ks08	1		Thunder frightens the dog.
ks08	1		The dog fears thunder.
ks08	1		The child broke the teapot by accident.
ks08	1		The teapot was broken by the child by accident.
ks08	1		This item belongs to the student.
ks08	0	*	The student is belonged to by this item.
ks08	1		He remained a good friend to me.
ks08	0	*	A good friend is remained to me by him.
ks08	1		John gave the boys the CDs.
ks08	1		She was sent a review copy of the book by the publisher.
ks08	1		She was sent a review copy of the book.
ks08	1		John gave the CDs to the boys.
ks08	1		My mother baked a cake for me.
ks08	1		A review copy of the book was sent to her by the publisher.
ks08	1		This is my ultimate goal.
ks08	1		Michelle became an architect.
ks08	1		They elected Graham chairman.
ks08	0	*	Chairman was elected Graham.
ks08	0	*	The best writer was considered Andrew.
ks08	1		John made Kim a great doll.
ks08	1		The situation became terrible.
ks08	1		This map is what he wants.
ks08	1		I consider him immoral.
ks08	1		I regard Andrew as the best writer.
ks08	1		They spoil their kids rotten.
ks08	1		John put books in the box.
ks08	1		They would inform Mary of any success they have made.
ks08	1		John bought a book for the student.
ks08	1		The bus stopped suddenly.
ks08	1		Shakespeare wrote his plays a long time ago.
ks08	1		They went to the theater in London.
ks08	1		He failed chemistry because he can’t understand it.
ks08	0	*	John gave Tom a book a record.
ks08	1		I saw this film several times last year during the summer.
ks08	1		My uncle visited today.
ks08	0	*	Today was visited by my uncle.
ks08	1		That John passed surprised her.
ks08	1		To finish this work on time is almost unexpected.
ks08	1		Under the bed is a safe place to hide.
ks08	1		They wondered what she did yesterday.
ks08	1		They believed that everybody would pass the test.
ks08	1		Are you going on holiday before or after Easter? I prefer after Easter.
ks08	1		That John passed surprised her, didn’t it?
ks08	0	*	That the march should go ahead and that it should be cancelled has been argued by different people at different times.
ks08	1		To delay the march and to go ahead with it have been argued by different people at different times.
ks08	0	*	To delay the march and to go ahead with it has been argued by different people at different times.
ks08	1		The little cat devoured a mouse last night.
ks08	1		John has been at Stanford for four years.
ks08	1		John studied hard to pass the exam.
ks08	1		She disappeared when the main party arrived.
ks08	1		A boy hit the ball.
ks08	1		A boy hit the ball.
ks08	1		A smith hammered the metal.
ks08	1		The student heard a strange sound.
ks08	1		John gave a book to the students.
ks08	1		John died last night.
ks08	1		John made a doll for his son.
ks08	1		John bought a lot of books for his sons.
ks08	1		John deprived his sons of game cards.
ks08	1		Mary received an award from the department.
ks08	1		John told the rumor to his friend.
ks08	1		John put his books in the attic.
ks08	1		The government kept all the money.
ks08	1		John hit the ball with a bat.
ks08	1		John wiped the window with a towel.
ks08	1		agt The cat chased pat the mouse.
ks08	1		pat The mouse was chased by agt the cat.
ks08	1		There still remains an issue to be solved.
ks08	1		There lived a man with his grandson.
ks08	1		John resembles his mother.
ks08	1		A is similar to B.
ks08	1		John runs into the house.
ks08	1		All of his conversation was reported to me.
ks08	1		Sandy removed her ballet shoes.
ks08	1		She was the nicest teacher in the Senior School.
ks08	1		They elected him America’s 31st President.
ks08	1		The next morning we set out for Seoul.
ks08	1		He saw the man with the stick.
ks08	1		This week will be a difficult one for us.
ks08	1		Last year I saw this film several times.
ks08	1		He baked Tom the bread last night.
ks08	1		That they have completed the course is amazing.
ks08	1		Everyone hoped that she would sing.
ks08	1		The gang robbed her of her necklace.
ks08	1		They helped us edit the script.
ks08	1		The teacher made students happy.
ks08	1		In the garden stands a statue.
ks08	1		Among the guests was sitting my friend Louise.
ks08	0	*	Among the guests were sitting my friend Louise.
ks08	1		This proved a decisive factor.
ks08	1		This proved my hypothesis.
ks08	1		The students all enjoyed that summer.
ks08	1		The students all worked that summer.
ks08	1		The scientist made her a robot.
ks08	1		The students called me a teacher.
ks08	1		John’s mother sent a letter to Mary.
ks08	1		John smelled the freshly baked bread.
ks08	1		Frank threw himself into the sofa.
ks08	1		The crocodile devoured the doughnut.
ks08	1		John came from Seoul.
ks08	1		The ice melted.
ks08	0	*	John put his gold.
ks08	1		John put his gold under the bathtub.
ks08	1		The defendant denied the accusation.
ks08	0	*	The defendant denied.
ks08	1		The teacher handed the student a book.
ks08	0	*	The teacher handed the student.
ks08	0	*	They eager to leave the meeting.
ks08	1		The senators know that the president is telling a lie.
ks08	0	*	The senators to be certain that the president is telling a lie.
ks08	0	*	The senators be certain that the president is telling a lie.
ks08	1		Tom offered advice to his students in his office.
ks08	1		John placed Kim behind the garage.
ks08	0	*	John placed him busy.
ks08	1		John kept him busy.
ks08	0	*	John stayed him busy.
ks08	0	*	John placed behind the counter.
ks08	0	*	John kept behind the counter.
ks08	1		John stayed behind the counter.
ks08	1		John deposited some money in the bank on Friday.
ks08	0	*	The UN blamed global warming on humans on natural causes.
ks08	1		Kim and Sandy met in Seoul in the lobby of the Lotte Hotel in March.
ks08	1		John deposited some money in the checking account and Mary did the same thing.
ks08	1		John deposited some money in the checking account on Friday and Mary did the same thing.
ks08	1		John deposited some money in the checking account on Friday and Mary did the same thing on Monday.
ks08	0	*	John gave a present to the student and Mary did the same thing to the teacher.
ks08	0	*	John locked Fido in the garage and Mary did so in the room.
ks08	1		Kim jogs on the hill.
ks08	1		Kim jogs under the hill.
ks08	1		Kim jogs over the hill.
ks08	1		Kim depends.
ks08	1		Kim relies on Sandy.
ks08	1		Kim depends on Sandy.
ks08	0	*	Kim depends for Sandy.
ks08	1		John met a student in the park.
ks08	0	*	John met in the park a student.
ks08	0	*	The problem disappeared the accusation.
ks08	1		The problem disappeared.
ks08	0	*	The defendant denied.
ks08	1		The boy gave the baby the book.
ks08	1		The bird devours the worm.
ks08	1		The birds devour the worm.
ks08	1		No photo of Max and sketch by his students appeared in the magazine.
ks08	0	*	Sketch by his students appeared in the magazine.
ks08	1		Every photo of Max and sketch by his students appeared in the magazine.
ks08	1		The present king of country music is more popular than the last one.
ks08	0	*	The king of Rock and Roll is more popular than the one of country music.
ks08	1		Which student were you talking about?
ks08	1		John put the book in the box.
ks08	0	*	In the box put John the book.
ks08	1		That he won the election surprised everybody.
ks08	1		John disappeared.
ks08	1		John sneezed.
ks08	1		The jury seemed ready to leave.
ks08	1		John seemed a fool.
ks08	1		John saw Fred.
ks08	1		Alice typed the letter.
ks08	1		The school board leader asked the students a question.
ks08	1		The parents bought non-fiction novels for the children.
ks08	1		John taught English Syntax to new students.
ks08	1		The sexual revolution makes some people uncomfortable.
ks08	1		Ad agencies call young people Generation X-ers.
ks08	0	*	John carried to the door.
ks08	1		John carried her on his back.
ks08	1		Tom locked Fido in the garage.
ks08	1		Tom played it under the table.
ks08	1		I wonder if you will come back tomorrow.
ks08	1		You would have a reply if you come back tomorrow.
ks08	1		Tom hid the manuscript in the cupboard.
ks08	1		Fred hired Sharon to change the oil.
ks08	1		They pushed the prisoners into the truck.
ks08	1		Frank hopes to persuade Harry to make the cook wash the dishes.
ks08	1		George mailed the attorney his photograph of the accident.
ks08	1		Jane left the book on the table.
ks08	1		We have not confirmed whether the flight had been booked.
ks08	1		They confined his remarks to the matter under discussion.
ks08	0	*	Oliver ascribed his longevity there.
ks08	0	*	Oliver fined ten pounds to the prisoner.
ks08	0	*	Oliver drove me a lunatic.
ks08	0	*	Oliver addressed the king the letter.
ks08	0	*	Oliver absented his brother from the meeting.
ks08	1		The students of English from Seoul faced many issues in the process of interpreting, transcribing, and editing the poems.
ks08	1		The love of my life and father of my children would never do such a thing.
ks08	1		The museum displayed no painting by Miro or drawing by Klee.
ks08	1		Learning to use a language freely and fully is a lengthy and effortful process.
ks08	0	*	Kim put the book.
ks08	0	*	Kim put in the box.
ks08	0	*	Talked with Bill about the exam.
ks08	1		They wrote to her.
ks08	1		They are kind to her.
ks08	1		They want to write to her.
ks08	0	*	They want to wrote to her.
ks08	1		They want to be kind to her.
ks08	1		The student knows the answers.
ks08	0	*	The student knowing the answers.
ks08	0	*	The student known the answers.
ks08	1		He is writing another long book about beavers.
ks08	1		Broadly speaking, the project was successful.
ks08	1		He is proud of his son’s passing the bar exam.
ks08	1		The chicken has eaten.
ks08	1		The chicken was eaten.
ks08	1		The monkeys kept forgetting their lines.
ks08	0	*	The monkeys kept forgot their lines.
ks08	0	*	The monkeys kept forgotten their lines.
ks08	1		We caught them eating the bananas.
ks08	0	*	We caught them eat the bananas.
ks08	0	*	We caught them eaten the bananas.
ks08	0	*	John made Mary to cook Korean food.
ks08	0	*	John made Mary cooking Korean food.
ks08	1		The monkey seems despondent.
ks08	1		He seems intelligent to study medicine.
ks08	1		Monkeys are eager to leave.
ks08	0	*	Monkeys are eager leaving the compound.
ks08	0	*	The chickens seem fond with the farmer.
ks08	1		The chickens seem fond of the farmer.
ks08	0	*	The foxes seem compatible for the chickens.
ks08	1		These are similar to the bottles.
ks08	0	*	These are similar with the bottles.
ks08	0	*	The teacher is proud with his students.
ks08	0	*	The contract is subject for approval by my committee.
ks08	1		There exists only one truly amphibian mammal.
ks08	1		There is a riot in the park.
ks08	0	*	There runs a man in the park.
ks08	1		They believe that Charles Darwin’s theory of evolution is just a scientific theory.
ks08	1		They believe Charles Darwin’s theory of evolution is just a scientific theory.
ks08	1		John demanded that she stop phoning him.
ks08	1		The rules require that the executives be polite.
ks08	1		Joe warned the class that the exam would be difficult.
ks08	1		We told Tom that he should consult an accountant.
ks08	1		Mary convinced me that the argument was sound.
ks08	1		Tom intends for Sam to review that book.
ks08	1		John would prefer for the children to finish the oatmeal.
ks08	1		For John to tell Bill such a lie and Bill to believe it is outrageous.
ks08	1		John intends to review the book.
ks08	1		John would prefer to finish the oatmeal.
ks08	0	*	Tom tried for Bill to ask a question.
ks08	1		Tom tends to avoid confrontations.
ks08	0	*	Tom tends for Mary to avoid confrontations.
ks08	1		Joe hoped to find a solution.
ks08	0	*	Joe hoped for Beth to find a solution.
ks08	1		John believed it.
ks08	1		John mentioned the issue to me.
ks08	1		John mentioned to me that the question is an issue.
ks08	1		She pinched his arm as hard as she could.
ks08	1		We hope that such a vaccine could be available in ten years.
ks08	0	*	We hope the availability of such a vaccine in ten years.
ks08	1		Cohen proved the independence of the continuum hypothesis.
ks08	1		Cohen proved that the continuum hypothesis was independent.
ks08	1		John bothers me.
ks08	1		John loves Bill.
ks08	0	*	That John snores loves Bill.
ks08	1		That John sold the ostrich surprised Bill.
ks08	1		For John to train his horse would be desirable.
ks08	1		Which otter you should adopt first is unclear.
ks08	0	*	That Tom missed the lecture was enjoyable.
ks08	0	*	For John to remove the mother is undeniable.
ks08	1		Tom is confident that the elephants respect him.
ks08	1		I am ashamed that I neglected you.
ks08	1		I am delighted that Mary finished his thesis.
ks08	1		We are content for the cleaners to return the drapes next week.
ks08	1		We were glad it was over.
ks08	1		Bill alleged that Fred signed the check.
ks08	1		We believe that the directors were present.
ks08	1		We convinced him that the operation is safe.
ks08	0	*	Alan is thinking about that his students are eager to learn English.
ks08	1		The outcome depends on how many candidates participate in the election.
ks08	1		Fred is thinking about whether he should stay in Seoul.
ks08	1		The offer made Smith admire the administrators.
ks08	1		John tried to make Sam let George ask Bill to keep delivering the mail.
ks08	1		John enjoyed drawing trees for his syntax homework.
ks08	1		Free enterprise is compatible with American values and traditions.
ks08	1		They were taking a hard look at possible FTA.
ks08	1		We need to be in frequent contact with the clients.
ks08	1		The contract is subject to approval by my committee.
ks08	0	*	Why don’t you leaving me concentrate on my work?
ks08	0	*	The general commended that all troops was in dress uniform.
ks08	0	*	You should avoid to travel in the rush hour.
ks08	0	*	The authorities charged the students of the cheating.
ks08	0	*	Sharon has been eager finishing the book.
ks08	0	*	We respect Mary’s desire for becoming famous.
ks08	0	*	John referred from the building.
ks08	0	*	John died to heart disease.
ks08	0	*	John paid me against the book.
ks08	0	*	We were glad what to do.
ks08	0	*	She was busy to make lunch.
ks08	1		The constant rain forced the abandonment of the next day’s competitions.
ks08	1		The committee will study the feasibility of setting up a national computer network.
ks08	1		Aloe may have an analgesic effect on inflammation and minor skin irritations.
ks08	1		The public never had faith in his ability to handle the job.
ks08	1		He repeated his claim that the people backed his action.
ks08	1		We made them take the money.
ks08	1		Do not use these words in the beginning of a sentence.
ks08	1		We know the witnesses seem eager to testify against the criminal.
ks08	1		Jane isn’t sure whether the students keep the books.
ks08	0	*	Book is available in most countries.
ks08	0	*	Student studies English for 4 hours a day.
ks08	1		Students study English for 4 hours a day.
ks08	1		His friend learned dancing.
ks08	1		My bother’s friend learned dancing.
ks08	1		The president’s bodyguard learned surveillance.
ks08	1		The King of Rock and Roll’s records led to dancing.
ks08	1		President Lincoln delivered his Gettysburg Address in 1863.
ks08	0	*	President Lincoln delivered her Gettysburg Address in 1863.
ks08	1		After reading the pamphlet, Judy threw it into the garbage can.
ks08	0	*	After reading the pamphlet, Judy threw them into the garbage can.
ks08	1		After the party, I asked myself why I had faxed invitations to everyone in my officebuilding.
ks08	1		Edward usually remembered to send a copy of his e-mail to himself.
ks08	1		No John Smiths attended the meeting.
ks08	1		This John Smith lives in Seoul.
ks08	1		There are three Davids in my class.
ks08	1		It’s nothing like the America I remember.
ks08	1		My brother is an Einstein at maths.
ks08	1		In the book, he talks about his ups and downs at school.
ks08	1		If John wants to succeed in corporate life, he has to know the rules of the game.
ks08	1		The critique of Plato’s Republic was written from a contemporary point of view.
ks08	1		The characters in Shakespeare’s Twelfth Night live in a world that has been turned upside-down.
ks08	1		You is the only person that I can rely on.
ks08	0	*	You are the only person that I can rely on.
ks08	0	*	He are the only person that I can rely on.
ks08	1		The boy swims.
ks08	0	*	The boys swim.
ks08	1		King prawns cooked in chili salt and pepper was very much better, a simple dish succulently executed.
ks08	1		Four pounds was quite a bit of money in 1950 and it was not easy to come by.
ks08	1		Fifteen dollars in a week is much.
ks08	0	*	Fifteen dollars in a week are not much.
ks08	1		Fifteen years represents a long period of his life.
ks08	0	*	Fifteen years represent a long period of his life.
ks08	1		Two miles is as far as they can walk.
ks08	0	*	Two miles are as far as they can walk.
ks08	1		This Government have been more transparent in the way they have dealt with public finances than any previous government.
ks08	1		This Government has been more transparent in the way they have dealt with public finances than any previous government.
ks08	1		In preparation for the return fixture this team have trained more efficiently than they had in recent months.
ks08	1		In preparation for the return fixture this team has trained more efficiently than they had in recent months.
ks08	1		She doesn’t believe much of that story.
ks08	1		We listened to as little of his speech as possible.
ks08	1		How much of the fresco did the flood damage?
ks08	0	*	She doesn’t believe much story.
ks08	0	*	We listened to as little speech as possible.
ks08	0	*	How much fresco did the flood damage?
ks08	0	*	I read some book.
ks08	1		Many of the people were dying of thirst.
ks08	1		Many people were dying of thirst.
ks08	1		Each of the suggestions is acceptable.
ks08	1		Neither of the cars has air conditioning.
ks08	1		None of these men wants to be president.
ks08	1		Most of the children are here.
ks08	1		Some of the soup needs more salt.
ks08	1		Some of the diners need menus.
ks08	1		All of the land belongs to the government.
ks08	0	*	Neither of students failed.
ks08	0	*	I drank some of water.
ks08	1		John is in the room.
ks08	1		Most of John’s boat has been repainted.
ks08	1		Some of the record contains evidence of wrongdoing.
ks08	1		Much of that theory is unfounded.
ks08	0	*	Each of John’s boat has been repainted.
ks08	0	*	One of the story has appeared in your newspaper.
ks08	1		He is alive.
ks08	1		He is afraid of foxes.
ks08	1		It is a wooden desk.
ks08	1		It is the main street.
ks08	0	*	It is an alive fish.
ks08	1		The boy in the doorway waved to his father.
ks08	1		The man eager to start the meeting is John’s sister.
ks08	1		The man holding the bottle disappeared.
ks08	1		The papers removed from the safe have not been found.
ks08	1		The money that you gave me disappeared last night.
ks08	0	*	John in the doorway waved to his father.
ks08	1		and index values of the subject and the main verb.
ks08	1		None of his customary excuses suffices Edgar now.
ks08	1		All of the plant virus web sites have been conveniently collected in one central location.
ks08	1		Some of the water from melted snow also goes into the ground for plants.
ks08	1		Most of the milk your baby ingests during breastfeeding is produced during nursing.
ks08	1		Each of these stones has to be cut and polished.
ks08	1		Most of her free time was spent attending concerts and plays or visiting museums and art galleries.
ks08	0	*	The committee were unanimous in their decision.
