bc01	1		I remembered having kissed Mary.
bc01	1		I reported having kissed Mary.
bc01	1		I enjoy taking a bath.
bc01	0	*	I enjoy him taking a bath.
bc01	0	*	I detest him taking a bath.
bc01	1		I saw him kissing Mary.
bc01	0	*	I saw kissing Mary.
bc01	0	*	I noticed kissing Mary.
bc01	1		John’s refusing the offer is shocking.
bc01	1		John wanted to leave the room happy and leave the room happy he did.
bc01	0	*	John wanted to leave the room happy and leave the room he did happy.
bc01	1		I only eat fish raw fresh.
bc01	1		I often send Mary home drunk, and she gets there just fine.
bc01	0	*	I only eat fish drunk raw.
bc01	1		José likes rutabagas, and Holly does too.
bc01	1		José is eating rutabagas, and Holly is too.
bc01	1		John wants to read Fred’s story, and I also want to.
bc01	1		I consider Bill intelligent and I consider Sally not.
bc01	0	*	Sally started running down the street, but only after José started.
bc01	0	*	Sally made Bill laugh, and then José made.
bc01	0	*	We wanted to invite someone, but we couldn’t decide who to.
bc01	0	*	Mary was told to bring something to the party, so she asked Sue what to.
bc01	1		You shouldn’t play with rifles because it’s dangerous to.
bc01	0	*	You shouldn’t play with rifles because to is dangerous.
bc01	1		José asks that we go to the meeting, and Sally will tell us when.
bc01	0	*	It’s we go to the meeting, that Sally will tell us when.
bc01	1		It’s to Mary that Joe said Holly can talk.
bc01	1		Mary claimed that eat rutabagas, Holly wouldn’t.
bc01	1		Mary claimed that eaten rutabagas, Holly hasn’t.
bc01	1		Mary claimed that eating rutabagas, Holly shouldn’t.
bc01	1		Mary claimed that eating rutabagas, Holly's not.
bc01	0	*	Mary claimed that would eat rutabagas, Holly.
bc01	0	*	Mary claimed that eating rutabagas, Holly started.
bc01	0	*	Mary claimed that have eaten rutabagas, Holly should.
bc01	.5	?	Mary claimed that discussed widely, I remember Holly being.
bc01	0	*	Mary claimed that intelligent, I consider Holly not.
bc01	0	*	Lilly recounted a story to remember because Holly had also recounted a story to.
bc01	.1	*?	I reviewed Joe’s attempt to find Holly while you reviewed José’s attempt to.
bc01	.1	*?	Mary questioned Joe’s desire to eat rutabagas, but only after I had questioned Sally’s desire to.
bc01	.1	*?	Sally explained the attempt to arrest Holly, but only after I haddenied the decision to.
bc01	1		John didn’t hit a home run, but I know a woman who did.
bc01	1		That Betsy won the batting crown is not surprising, but that Peter didn't know she did is surprising.
bc01	0	*	Mary came to be introduced by the barkeep and I also came to be.
bc01	0	*	You shouldn’t have played with rifles because to have is dangerous.
bc01	0	*	Lilly recounted a story to be remembered because Holly had recounted a story to be.
bc01	1		Lilly decided that eating rutabagas, she should be.
bc01	0	*	Lilly decided eating rutabagas, to be.
bc01	1		Read Fred’s story, I also want to.
bc01	.3	??	Ron wanted to wear a tuxedo to the party, but wear a tuxedo to the party Caspar couldn't decide whether to.
bc01	1		Mag Wildwood came to introduce the barkeep but I came not to.
bc01	1		You should unload rifles because not to s is dangerous.
bc01	1		If Ron knows whether to wear a tuxedo, and Caspar knows whether not to, do they know different things?
bc01	1		Lulamae recounted a story to remember because Holly had recounted as story not to.
bc01	1		If I can, I will work on it.
bc01	0	*	I will, if I can work on it.
bc01	1		Did Harry leave?
bc01	0	*	A proof that God exist does.
bc01	0	*	I visited every town in every country I had to.
bc01	1		Every man who said he would buy some salmon did.
bc01	1		I visited every town I had to.
bc01	1		I visited every town I had to visit.
bc01	1		a.Every town in every country I had to I visited.
bc01	1		Every man who said he would buy some salmon did buy some salmon.
bc01	1		Lilly should buy salmon and Mary should too.
bc01	1		Lilly should buy salmon and Mary should buy salmon too.
bc01	1		Joe likes his bar, and Sally does too.
bc01	1		Joe’s idiosyncracies bother his patrons, and Sally’s idiosyncracies do too.
bc01	1		Every picture of itself arrived.
bc01	0	*	My uncle didn’t buy anything for Christmas, but my aunt did it for him and it was bright red.
bc01	1		I know which book Max read, and which book Oscar didn’t.
bc01	0	*	I know which book José didn’t read for class, and which book Lilly did it for him.
bc01	0	*	This is the book which Bob reviewed, and this is the one which Fred won't do it.
bc01	1		I know which book Mag read, and which book Bob said that you hadn't.
bc01	.1	?*	I know which book Mag read, and which book Bob asked why you hadn't.
bc01	.1	?*	I know which book Mag read, and which book Bob read my report that you hadn't.
bc01	1		Dulles suspected everyone who Angleton did.
bc01	0	*	Dulles suspected everyone who Angleton did it.
bc01	0	*	Dulles suspected everyone who Angleton did so.
bc01	1		I know which book Max read, and which book Oscar didn’t.
bc01	1		Dulles suspected everyone who Angleton did.
bc01	1		Sally suspected Joe, but he didn’t Holly.
bc01	.1	?*	Near everyone Angleton did, Dulles stood.
bc01	0	*	Sally will stand near Mag, but he won’t Holly.
bc01	0	*	While Holly didn’t discuss a report about every boy, she did every girl.
bc01	.5	?	I know which woman Fred will stand near, but I don’t know which woman you will.
bc01	1		I know which woman Holly will discuss a report about, but I don't know which woman you will.
bc01	0	*	Sam stood near yesterday every one of the women we’d been discussing.
bc01	0	*	Truman told the story Bob.
bc01	1		While José won’t talk about Mag, he might about Holly.
bc01	1		Although Doc might tell it to you, he won’t to me.
bc01	1		I’m sure I would like him to eat fruit more than I would cookies.
bc01	.5	?	While I wouldn’t like him to eat cookies, I would fruit.
bc01	0	*	While Rusty might leave in order to please Mag, he won’t his father.
bc01	0	*	While Doc might claim that Bob had read his book, he won't the paper.
bc01	1		Fred gave flowers to his sweetie because Frank had.
bc01	1		China is a country that Joe wants to visit, and he will too, if he gets enough money.
bc01	1		Jerry wouldn’t read a book by Babel, but Meryl has done so and it was pretty good.
bc01	0	*	I know which book Max read, and which book Oscar hasn’t done so.
bc01	1		While I might want to, this is the kind of thing that Harris has already suggested.
bc01	1		We like our friends and they do too.
bc01	1		We like our friends and they like our friends too.
bc01	1		Rusty talked about himself only after Holly did.
bc01	0	*	Rusty talked about himself only after Mary did talk about himself.
bc01	1		Rusty talked about himself only after Mary did talk about him.
bc01	1		I could find no solution, but Holly might.
bc01	1		Fred talked about everything before Rusty did talk about something.
bc01	1		Joe will go to the store, even though Fred already has.
bc01	1		The candidate was dogged by charges of infidelity and avoiding the draft, or at least trying to.
bc01	0	*	David is a great artist, and when he does, his eyes crinkle at you.
bc01	0	*	The candidate was dogged by charges of infidelity, or at least trying to.
bc01	1		This information could have been released by Gorbachev, but he chose not to.
bc01	1		A lot of this material can be presented in a fairly informal and accessible fashion, and often I do.
bc01	.5	?	John fired Max, although it was Bill who should have been.
bc01	0	*	John likes not Mary.
bc01	1		John does not like Mary.
bc01	1		John often meets Mary.
bc01	0	*	John meets often Mary.
bc01	0	*	John tries to meet not Mary.
bc01	0	*	Runs Mary the marathon?
bc01	1		Mary is often running the marathon.
bc01	1		Mary is not running the marathon.
bc01	0	*	Mary runs not the marathon.
bc01	1		I didn’t, as Bill had thought, go to the store.
bc01	0	*	I did not, as Bill had thought, go to the store.
bc01	1		The writers could so believe the boy.
bc01	0	*	The writers so believed the boy.
bc01	1		The writers did so believe the boy.
bc01	1		Rome destroyed Carthage.
bc01	1		Rome’s destruction of Carthage was horrific.
bc01	1		John bought the picture of himself that Bill saw.
bc01	1		The perception of the problem is quite thorough.
bc01	1		The knowledge of the problem is quite thorough.
bc01	0	*	The problem’s knowledge is quite thorough.
bc01	0	*	The problem knows easily.
bc01	0	*	The ship sank to collect the insurance.
bc01	1		The sinking of the ship to collect the insurance was very devious.
bc01	1		The ship’s sinking was very devious.
bc01	0	*	The ship’s sinking to collect the insurance was very devious.
bc01	0	*	This drug’s testing on oneself is too risky.
bc01	1		This drug must first be tested on oneself.
bc01	1		The president’s moral destruction is complete.
bc01	1		The probable hostile German reaction is unfortunate.
bc01	1		Mary wants to wear nice blue German dress.
bc01	1		Tomatoes were introduced in Europe after 1492.
bc01	1		We rich have impeccable taste.
bc01	0	*	I read three his books.
bc01	0	*	I read every his book.
bc01	1		I read his every book.
bc01	1		I showed every boy a planet.
bc01	1		Few boys read any of the books.
bc01	1		I showed few boys any of the books.
bc01	0	*	That few boys came upset any of the teachers.
bc01	1		Most boys did not laugh.
bc01	1		Every boy named Mercury and Venus.
bc01	1		Each student speaks two languages.
bc01	1		Two students speak each language.
bc01	1		Some tourists visited all the museums.
bc01	1		Fond of some boy every girl is.
bc01	1		A critic thinks that every book is readable.
bc01	1		Who does he admire?
bc01	1		He admires every man.
bc01	1		Who admires what?
bc01	1		Someone from every city hates it.
bc01	1		Some professor admires every student and hates the dean.
bc01	0	*	You filed every paper without inspecting.
bc01	1		Everyone reported that Max and some lady disappeared.
bc01	1		Most guests will be offended if we don’t invite some philosopher.
bc01	1		All students believe anything that many teachers say.
bc01	1		Who reported that Max and which lady disappeared?
bc01	1		Who will be offended if we don’t invite which philosopher?
bc01	1		Who believes anything that who says?
bc01	1		Exactly two boys kissed some girl.
bc01	1		Every student has to come up with three arguments that show that some condition proposed by Bill is wrong.
bc01	1		Three relatives of mine inherited a house.
bc01	1		If three relatives of mine die, I will inherit a house.
bc01	1		Everyone attended some seminar.
bc01	1		Exactly half of the students attended some seminar.
bc01	1		More than three students attended every seminar.
bc01	1		Every student attended more than three seminars.
bc01	0	*	Every man surrounded the fort.
bc01	1		The men surrounded the fort.
bc01	1		A hundred men surrounded the fort.
bc01	1		The men lifted the table together.
bc01	1		A hundred men lifted the table together.
bc01	1		Every man lifted a table.
bc01	1		Someone attended every seminar.
bc01	1		Everyone attended some seminar.
bc01	1		More than two students attended every seminar.
bc01	1		Everyone attended more than two seminars.
bc01	1		You married no one.
bc01	1		I will force you to marry no one.
bc01	1		We elected me.
bc01	1		Everyone who had been worrying himself stiff said that he was relieved.
bc01	1		There were five tourists in the room apart from myself.
bc01	1		Physicists like yourself are a godsend.
bc01	1		Max boasted that the queen invited Lucie and himself for a drink.
bc01	1		Which pictures of him did Earl see?
bc01	1		Bill seems to him to be handsome.
bc01	1		John will see which picture of himself?
bc01	1		Each other’s houses appear to the women to be overdecorated.
bc01	0	*	Each other’s houses proved to the women that they had bad taste.
bc01	0	*	These stories about himself describe John better than any official biography.
bc01	1		Images of themselves seem to have frightened the children.
bc01	1		Which picture that John took at the party did he decide to display in his house?
bc01	0	*	Which report that John was incompetent did he submit?
bc01	1		Mary has always preferred lemons to limes.
bc01	1		Lemons are always preferred to limes.
bc01	1		Mary always has preferred lemons to limes.
bc01	0	*	The cat that the dog that the rat bit chased died.
bc01	1		Jean never reads this newspaper.
bc01	0	*	Jean reads never this newspaper.
r-67	1		A gun went off which I had cleaned.
r-67	1		I gave a gun which I had cleaned to my brother.
r-67	1		He let the cats out which were meowing.
r-67	1		What did Bill buy?
r-67	0	*	What did that Bill wore surprise everyone?
r-67	0	*	What dl,d John fall asleep and Bill wear?
r-67	1		Who did Mary see walking toward the railroad station?
r-67	1		Do you know the boy whom Mary saw?
r-67	1		Mary saw the boy walking toward the railroad station.
r-67	1		The government prescribes the height of the lettering on the covers of the reports.
r-67	0	*	Here is the snowball which I chased the boy who threw at our teacher.
r-67	0	*	Where's the bikini which Tom mentioned the fact that Sue had worn?
r-67	0	*	A proof that the claim had been. made was giver that John had lied.
r-67	0	*	Who did he expect who I was acquainted with to show up?
r-67	1		Whose book did you find?
r-67	1		I know a boy who is mad at John.
r-67	1		I know a boy mad at John.
r-67	1		John is taller than Bill is.
r-67	1		I want to go.
r-67	1		Shaving myself is difficult for me.
r-67	1		The shock touched the explosion off.
r-67	0	*	I ran a man who was old down.
r-67	1		I ran an old man down.
r-67	0	*	I'm going to call somebody who is.
r-67	0	*	I polished the vase which was from India up.
r-67	1		He attributed the fire to a short circuit.
r-67	0	*	He attributed to a short circuit the fire.
r-67	1		He attributed to a short circuit the fire which.
r-67	1		He threw the letter into the wastebasket.
r-67	0	*	He threw into the wastebasket the letter.
r-67	1		They dismissed the proposal as too costly.
r-67	0	*	They dismissed as to costly the proposal.
r-67	1		He attributed to a short circuit which was caused by an overloaded transducer the fire which destroyed most of my factory.
r-67	1		I found to be delicious some fruit which I picked up on the way home.
r-67	1		I found delicious some fruit which I picked up on my way home.
r-67	.1	?*	The mayor regarded as being absurd the proposal to build a sidewalk from Dartmouth to Smith.
r-67	0	*	I consider to be a fool the senator who made the opening speech.
r-67	.5	?	I consider a fool the senator who made the opening speech.
r-67	0	*	Did that John showed up please you?
r-67	1		Did the fact that John showed up please you?
r-67	.1	?*	That that John showed up pleased her was obvious.
r-67	.5	?	*For whether she died to remain unclear would spoil the play.
r-67	.1	?*	I want that Bill left to remain a secret.
r-67	1		I want the fact that Bill left to remain a secret.
r-67	1		I want it to remain a secret that Bill left.
r-67	0	*	What what I ate cost almost broke me.
r-67	1		What the thing which I ate cost almost broke me.
r-67	1		What the thing cost which I ate almost broke me.
r-67	0	*	I went out with a girl who that John showed up pleased.
r-67	.5	?	I went out with a girl who the fact that John showed up pleased.
r-67	1		I went out with a girl who it pleased that John showed up.
r-67	1		I loaned a man who was watching the race my binoculars.
r-67	0	*	I loaned my binoculars a man who was watching the race.
r-67	1		She asked a man who was near the window whether it looked like rain.
r-67	.5	?	All those speeches made my father, who had just turned 60, mad.
r-67	0	*	They gave my father, who had just turned 60, it.
r-67	1		He figured it out.
r-67	0	*	He figured out it.
r-67	0	*	He figured out that.
r-67	.1	?*	He figured out Ann.
r-67	1		He figured something out.
r-67	1		He figured the answer out.
r-67	0	*	I sent him it.
r-67	1		I sent him that.
r-67	.5	?	I sent him Andy.
r-67	.1	?*	We elected the man who he had brought with him president.
r-67	1		They gave the reports which he had brought with him to me.
r-67	0	*	He kept company some girls who had been injured in the wreck.
r-67	.5	?	He kept some girls company who had been injured in the wreck.
r-67	0	*	I insist on seeing through all the students who had started out the term in my class.
r-67	1		I insist on seeing all the student' through who started out the term in my class.
r-67	0	*	The doctor brought to the passengers who had passed cut from the fumes.
r-67	.5	?	The doctor brought the passengers to who had passed out from the fumes.
r-67	0	*	He tries to put on everyone who he doesn't like.
r-67	.1	?*	He tries to put everyone who he doesn't like on.
r-67	.5	?	He tries to put everyone on who he doesn't like.
r-67	0	*	I watched the Indians who the man who had been my advisor in my freshman year had advised me to study when I got to Utah talk.
r-67	1		Tom drives like that man.
r-67	0	*	I know a man who Tom drives as drives.
r-67	0	*	I know a man who Tom drives as does.
r-67	1		I know a man who Tom drives like.
r-67	1		Tom drives the way that that man drives.
r-67	1		John is taller than that man is.
r-67	1		is taller than that man.
r-67	0	*	I know a man who John is taller than is.
r-67	1		I know a man who John is taller than.
r-67	1		John is as tall as that man is.
r-67	1		John is as tall as that man.
r-67	1		I know a man who John is as tall as.
r-67	1		Mary has never kissed a man who is taller than John is.
r-67	1		Mary has never kissed a man who is taller than John.
r-67	1		Mary has never kissed a Man taller than John.
r-67	0	*	Mary has never kissed a man taller than John is.
r-67	.1	?*	Mary has never kissed as tall a man as John is.
r-67	1		The brave are not afraid to die.
r-67	1		Drowning cats is against the law.
r-67	0	*	Drowning cats, which is against the law, are hard to rescue.
r-67	1		I know a taller man than John.
r-67	1		He told Peter that I know a taller man than John, but Peter didn't believe it.
r-67	1		I divulged when Bill promised to call me, but I did so reluctantly.
r-67	1		I read a statement which was about that man.
r-67	1		I read a statement about that man.
r-67	1		The man who I read a statement about is sick.
r-67	1		I read that Bill had seen me.
r-67	0	*	I read that Bill had seen myself.
r-67	1		Evidence that he was drunk will be presented.
r-67	1		Evidence will be presented that he was drunk.
r-67	1		What I said was that she was lying.
r-67	1		Muriel said nothing else than that she had been insulted.
r-67	1		This is a hat which I'm going to see to it that my wife buys.
r-67	1		Phineas knows a girl who is jealous of Maxime.
r-67	1		Phineas knows a girl who is behind Maxime.
r-67	1		Phineas knows a girl who is working with Maxime.
r-67	0	*	Who does Phineas know a girl who is jealous of? .
r-67	0	*	Who does Phineas know a girl who is working with?
r-67	0	*	Who does Phineas know a girl jealous of?
r-67	0	*	Who does Phineas know a girl working with?
r-67	0	*	The hat which I believed the claim that Otto was wearing is red.
r-67	1		The hat which I believed that Otto was wearing is red.
r-67	1		Rutherford understands himself.
r-67	0	*	Himself is understood by Rutherford.
r-67	1		The man who ordered ice cream said the pudding would be tasty.
r-67	1		The pudding which the man who ordered ice cream said would be tasty was a horror show.
r-67	1		The man who ordered it said the pudding would be tasty.
r-67	0	*	The pudding which the man who ordered it said would be tasty was a horror show.
r-67	1		The sheriff denied that gangsters had bribed him.
r-67	0	*	The money which I am discussing the claim that the company squandered amounts to $400,000.
r-67	0	*	The money which I am discussing Sarah's claim that the company squandered amounts to $400,000.
r-67	1		The money which I will have a chance to squander amounts to $400,000.
r-67	1		The money which I will make a proposal for us to squander amounts to $400,000.
r-67	1		The money which I will make a proposal that we squander amounts to $400,000.
r-67	1		I snoozed.
r-67	1		Sam progressed.
r-67	1		Bill gave me $40.
r-67	1		I feel that Arch will show up.
r-67	1		Max gave the car a shove.
r-67	1		I have a feeling that Arch will show up.
r-67	1		Bob proved that this set is recursive.
r-67	1		Bob proved this set is recursive.
r-67	1		The proof that this set is recursive is difficult.
r-67	0	*	The proof this set is recursive is difficult.
r-67	1		The proof that this set is recursive is difficult.
r-67	0	*	The proof this set is recursive is difficult.
r-67	.5	?	I am making the claim the company squandered the money.
r-67	1		I have hopes the company will squander the money.
r-67	1		I have a feeling the company will squander the money.
r-67	0	*	I made a proposal we squander the money.
r-67	1		Dick's claim that semantics is generative is preposterous.
r-67	0	*	Myron is making Suzie's claim that dead is better than red.
r-67	1		Myron is making the claim that dead is better than red.
r-67	0	*	I have Tom's feeling that the company will squander the money.
r-67	0	*	Bill made Sarah's gal to me of $40.
r-67	0	*	Max gave the car Levi's shove.
r-67	1		The man who was arrested by Officer Bob went mad.
r-67	1		Jack is claiming that you won't need it.
r-67	1		Jack is claiming you won't need it.
r-67	1		Jack is making the claim you won't need it.
r-67	0	*	The claim you won't need it is being made by Jack.
r-67	1		I read a statement which was about that man.
r-67	1		You're going to hurt yourself one of these days.
r-67	1		I spoke to Bill about himself.
r-67	0	*	I know a man who hates myself.
r-67	1		I know two men who are behind me.
r-67	0	*	I know two men behind myself.
r-67	1		You are too flip with people who are jealous of you.
r-67	1		I screamed at some children watching me.
r-67	0	*	What sofa will he put the chair between some table and?
r-67	0	*	The lute which Henry plays and sings madrigals is warped.
r-67	0	*	The nurse who polished her trombone and the plumber computed my tax was a blond.
r-67	0	*	Which trombone did the nurse polish and?
r-67	0	*	The plumber who the nurse polished her trombone and computed my tax was a hefty fellow.
r-67	1		Irma washed the dishes, and Sally dried, and Floyd loafed.
r-67	1		John left, and he didn't even say goodbye.
r-67	1		I went to the store and bought some whisky.
r-67	1		Here's the whisky which I went to the store and bought.
r-67	1		Here's the whisky which I went to the store and Mike bought.
r-67	1		I went to the movies and didn't pick up the shirts.
r-67	0	*	The shirts which I went to the movies and didn't pick up will cost us a lot of money.
r-67	1		I went to the store and have bought some excellent whisky.
r-67	0	*	The excellent whisky which I went to the store and have bought was very costly.
r-67	0	*	Tony has a Fiat to yearn for a tall nurse.
r-67	0	*	I went to the movies not to pick the shirts up.
r-67	0	*	I went to the movies to not pick the shirts up.
r-67	1		She's gone and ruined her dress now.
r-67	1		I've got to try and find that screw.
r-67	1		Aunt Hattie wants you to be nice and kiss your granny.
r-67	1		The screw which I've got to try and find holds the frammis to the myolator.
r-67	1		Which granny does Aunt Hattie want me to be nice and kiss?
r-67	1		The boy works in a skyscraper and the girl works in a quonset hut.
r-67	1		The boy works in a skyscraper and the girl in a quonset hut.
r-67	0	*	The skyscraper which the boy works in and the girl in a quonset hut belongs to Uncle Sam.
r-67	0	*	The girl who the by works in a skyscraper and in a quonset but has a dimple on her nose.
r-67	1		The luscious chick who Billy went to the movies with will wed me ere the morn.
r-67	1		Sally might be pregnant, and everyone believes Sheila definitely is pregnant.
r-67	1		Sally might be, and everyone believes Sheila definitely is, pregnant.
r-67	1		Tom picked these grapes, and I washed these grapes, and Suzie will prepare these grapes.
r-67	1		Tom picked these grapes, and I washed some turnips, and Suzie will prepare these grapes.
r-67	0	*	Tom picked, and I washed some turnips, and Suzie will prepare, these grapes.
r-67	1		Students who fail the final exam or who do not do the reading will be executed.
r-67	1		I heated up the coffee and Sally wiped the table off.
r-67	1		That Peter showed up is a miracle and it is doubtful that he'll ever come again.
r-67	0	*	I claimed it that Bob was a nut.
r-67	1		Although Bob may not be a nut, many people have claimed it and I think so too.
r-67	0	*	Although Bob may not be a nut, many people have claimed and I think so too.
r-67	1		When did you get back and what did you bring me?
r-67	0	*	Sally's sick and what did you bring me?
r-67	0	*	Make yourself comfortable and I got sick.
r-67	0	*	What are you eating or did you play chess ?
r-67	0	*	Which boy and the girl embraced?
r-67	0	*	I'm hungry and did you play chess?
r-67	1		Who ate what?
r-67	1		Who gave what to whom?
r-67	1		Where did you go and who ate what?
r-67	1		What exploded when'md who was hurt?
r-67	1		How long did this fit of generosity last and who gave what to whom?
r-67	0	*	I saw you there and who ate what?
r-67	0	*	What exploded when and I warned you it would?
r-67	1		If you make yourself comfortable, I'll wash the dishes.
r-67	1		Please make yourself comfortable and I'll wash the dishes.
r-67	1		You please make yourself comfortable and I'll wash the dishes.
r-67	1		Harry will be in the Marines next year and Herman was drafted last night.
r-67	1		Fred tore the curtain in roiling it up.
r-67	.3	??	The blintzes which Sasha is gobbling down faster than I can reheat are extremely tasty, if I do say so.
r-67	1		The curtain which Fred tore in rolling up was the kind gift of my maternal Aunt Priscilla.
r-67	1		I want to peruse that contract before damaging it while filing it .away.
r-67	.5	?	I want to peruse that contract after copying it by treating it in milk while pressing it between two pieces of marble in flattening it out.
r-67	1		Sasha is gobbling down blintzes faster than I can reheat the fishballs.
